{
  "$schema": "./stage-2-matrix.schema.json",
  "contract_version": "1.0.0",
  "status": "design_contract",
  "gates": [
    {
      "id": "stage2_design",
      "label": "阶段 2 设计收口",
      "pass_rule": "所有阶段 2 合同均有测试追踪，机器文件通过结构、引用、唯一性和覆盖检查，且没有 P0 设计缺口。"
    },
    {
      "id": "implementation",
      "label": "进入发布候选前的实现门禁",
      "pass_rule": "全部 P0 自动化用例通过，P1 无阻断缺陷，三条主链使用确定性或 Mock Provider 跑通，重启、幂等和并发恢复通过。"
    },
    {
      "id": "release",
      "label": "第一版发布门禁",
      "pass_rule": "真实小说、非小说和几十集视频样本完成业务抽查，迁移 Dry Run、桌面浏览器 QA、数据保全和部署恢复门禁全部通过。"
    }
  ],
  "fixtures": [
    {
      "id": "fixture_zero_capability",
      "kind": "synthetic",
      "owner": "development",
      "availability": "planned",
      "description": "空 Registry、一个空作品、文本/图片/文件索引，用于验证无 Domain Capability 的 Agent Shell。"
    },
    {
      "id": "fixture_execution_modes",
      "kind": "synthetic",
      "owner": "development",
      "availability": "planned",
      "description": "包含 inline、background_task 和 stateful_workflow 的测试 Skill，用于验证 Invocation 与 Business Run 的边界。"
    },
    {
      "id": "fixture_contract_assets",
      "kind": "generated",
      "owner": "development",
      "availability": "available",
      "description": "当前 docs、schemas、capabilities 和 video rules/prompts 设计资产。"
    },
    {
      "id": "fixture_runtime_synthetic",
      "kind": "synthetic",
      "owner": "development",
      "availability": "planned",
      "description": "两个作品、多个 Run/Artifact/Approval/Event、冲突和重启状态的确定性 Runtime 数据。"
    },
    {
      "id": "fixture_asset_edges",
      "kind": "synthetic",
      "owner": "development",
      "availability": "planned",
      "description": "格式伪装、超限、中断、重复集、缺集、无集号、过期和删除失败等文件元数据。"
    },
    {
      "id": "fixture_novel_regression",
      "kind": "real",
      "owner": "product",
      "availability": "provided_at_acceptance",
      "description": "产品负责人提供的一本真实小说，固定反复回归完整小说链。"
    },
    {
      "id": "fixture_non_novel_synthetic_v1",
      "kind": "synthetic",
      "owner": "development",
      "availability": "available",
      "description": "同一原创故事的完整大纲、简略梗概和零散设定三个完整度版本，位于 acceptance/fixtures/non-novel/。"
    },
    {
      "id": "fixture_video_series_real",
      "kind": "real",
      "owner": "product",
      "availability": "provided_at_acceptance",
      "description": "产品负责人提供的一部几十集漫剧，至少分两批上传。"
    },
    {
      "id": "fixture_legacy_snapshot",
      "kind": "snapshot",
      "owner": "development",
      "availability": "planned",
      "description": "从旧系统一致性快照生成的脱敏迁移样本，保留数量、ID、状态和哈希用于对账。"
    },
    {
      "id": "fixture_provider_failures",
      "kind": "synthetic",
      "owner": "development",
      "availability": "planned",
      "description": "超时、限流、结构错误、迟到结果、重复回调和不可用 Provider 的可控响应。"
    },
    {
      "id": "fixture_quality_review_synthetic",
      "kind": "synthetic",
      "owner": "development",
      "availability": "planned",
      "description": "包含通过、blocker、high、medium、low、唯一根因、输入变化、返工和风险覆盖的剧本审核结果。"
    }
  ],
  "cases": [
    {
      "id": "DES-001",
      "area": "design",
      "title": "阶段 2 合同全部被测试追踪",
      "priority": "P0",
      "level": "contract",
      "automation": "automated",
      "required_by": "stage2_design",
      "fixture_ids": ["fixture_contract_assets"],
      "contract_refs": ["docs/stage-2-architecture-baseline.md#16", "docs/stage-2-acceptance-test-matrix.md#10"],
      "assertions": ["阶段 2 的架构、Registry、Runtime、Dependency、Context、Asset、API、UI、Workflow Schema 和迁移合同各至少被一个用例引用。"]
    },
    {
      "id": "DES-002",
      "area": "design",
      "title": "机器矩阵结构、ID 和引用有效",
      "priority": "P0",
      "level": "contract",
      "automation": "automated",
      "required_by": "stage2_design",
      "fixture_ids": ["fixture_contract_assets"],
      "contract_refs": ["acceptance/stage-2-matrix.schema.json"],
      "assertions": ["JSON 可解析、用例和 Fixture ID 唯一、枚举合法、所有 Fixture 与合同引用存在。"]
    },
    {
      "id": "DES-003",
      "area": "design",
      "title": "设计、实现和发布门禁不混报",
      "priority": "P0",
      "level": "contract",
      "automation": "automated",
      "required_by": "stage2_design",
      "fixture_ids": ["fixture_contract_assets"],
      "contract_refs": ["docs/stage-2-acceptance-test-matrix.md#4", "docs/stage-2-architecture-baseline.md#16"],
      "assertions": ["设计完成不得被标记为业务实现通过，真实样本与压力测试仍属于后续门禁。"]
    },
    {
      "id": "DES-004",
      "area": "design",
      "title": "第一版范围外能力没有进入强制实现",
      "priority": "P1",
      "level": "contract",
      "automation": "automated",
      "required_by": "stage2_design",
      "fixture_ids": ["fixture_contract_assets"],
      "contract_refs": ["docs/stage-1-product-definition.md#19", "docs/stage-2-architecture-baseline.md#14"],
      "assertions": ["移动端、登录、多人协作、独立音频、自动查重、OCR/ASR 三模型管线和任意插件安装不成为第一版 P0。"]
    },
    {
      "id": "DES-005",
      "area": "design",
      "title": "Capability 机器合同与权威文档语义一致",
      "priority": "P0",
      "level": "contract",
      "automation": "automated",
      "required_by": "stage2_design",
      "fixture_ids": ["fixture_contract_assets"],
      "contract_refs": [
        "acceptance/validate-capability-contracts.mjs",
        "capabilities/v1/manifest.schema.json",
        "capabilities/v1/response-adapters.json",
        "docs/capability-registry-contract.md",
        "docs/capability-workflow-schema-contract.md"
      ],
      "assertions": [
        "三个 Manifest 通过 Schema 子集校验，Step 图与终止条件有效，Prompt/Rule/Schema/JSON Pointer 可解析，Adapter 已注册，Registry 不再包含废弃 Step ID。"
      ]
    },
    {
      "id": "SHELL-001",
      "area": "shell",
      "title": "零 Capability 时 Agent 仍可普通对话",
      "priority": "P0",
      "level": "e2e",
      "automation": "automated",
      "required_by": "implementation",
      "fixture_ids": ["fixture_zero_capability"],
      "contract_refs": ["docs/capability-registry-contract.md#27.2", "docs/capability-context-pack-contract.md#43.9"],
      "assertions": ["空 Registry 下能回复普通问题且不创建 Domain Run 或未知 Artifact。"]
    },
    {
      "id": "SHELL-002",
      "area": "shell",
      "title": "零 Capability 时可管理作品和查看材料",
      "priority": "P0",
      "level": "integration",
      "automation": "automated",
      "required_by": "implementation",
      "fixture_ids": ["fixture_zero_capability"],
      "contract_refs": ["docs/frontend-capability-ui-contract.md#9.7", "docs/capability-registry-contract.md#27.2"],
      "assertions": ["Project 新建、打开、重命名、删除和 Asset 查看不依赖 Domain Capability。"]
    },
    {
      "id": "SHELL-003",
      "area": "shell",
      "title": "能力缺失时明确说明而不自由执行",
      "priority": "P0",
      "level": "integration",
      "automation": "automated",
      "required_by": "implementation",
      "fixture_ids": ["fixture_zero_capability"],
      "contract_refs": ["docs/capability-registry-contract.md#27.2", "docs/api-event-contract.md#10.2"],
      "assertions": ["用户请求生成剧本时说明当前缺少对应 Skill，不伪造执行成功。"]
    },
    {
      "id": "SHELL-004",
      "area": "shell",
      "title": "通用图片输入按意图解释",
      "priority": "P1",
      "level": "e2e",
      "automation": "hybrid",
      "required_by": "release",
      "fixture_ids": ["fixture_zero_capability"],
      "contract_refs": ["docs/api-event-contract.md#28", "docs/stage-1-product-definition.md#8"],
      "assertions": ["图片作为通用输入处理；意图不明确时追问，不自动启动视频或文本 Skill。"]
    },
    {
      "id": "SHELL-005",
      "area": "shell",
      "title": "显式 Skill、自动路由和模糊追问",
      "priority": "P0",
      "level": "e2e",
      "automation": "hybrid",
      "required_by": "implementation",
      "fixture_ids": ["fixture_novel_regression", "fixture_non_novel_synthetic_v1"],
      "contract_refs": ["docs/stage-1-product-definition.md#18.5", "docs/frontend-capability-ui-contract.md#9"],
      "assertions": ["三种入口分别选择正确 Capability；仅点击 Skill 或仅上传文件都不立即启动 Run。"]
    },
    {
      "id": "SHELL-006",
      "area": "shell",
      "title": "Skill Invocation 与 Business Run 分离",
      "priority": "P0",
      "level": "integration",
      "automation": "automated",
      "required_by": "implementation",
      "fixture_ids": ["fixture_execution_modes"],
      "contract_refs": ["docs/general-agent-global-architecture-audit.md#3", "docs/capability-registry-contract.md#3.5"],
      "assertions": ["连续调用 inline Skill 不创建 Run；background_task 不伪装为 Run；只有已确认的 stateful_workflow Invocation 可委托为 Run。"]
    },
    {
      "id": "REG-001",
      "area": "registry",
      "title": "三个 Capability Manifest 合法且 ID 唯一",
      "priority": "P0",
      "level": "unit",
      "automation": "automated",
      "required_by": "implementation",
      "fixture_ids": ["fixture_contract_assets"],
      "contract_refs": ["capabilities/v1/manifest.schema.json", "docs/capability-registry-contract.md#27.1"],
      "assertions": ["三个 Manifest 通过 Schema，Capability ID 和 Step ID 在各自作用域内唯一。"]
    },
    {
      "id": "REG-002",
      "area": "registry",
      "title": "Manifest 的 Prompt、Rule 和 Schema 引用可解析",
      "priority": "P0",
      "level": "unit",
      "automation": "automated",
      "required_by": "implementation",
      "fixture_ids": ["fixture_contract_assets"],
      "contract_refs": ["docs/capability-workflow-schema-contract.md#12", "docs/capability-registry-contract.md#27.1"],
      "assertions": ["所有相对路径和 JSON Pointer 存在；缺失引用只令对应 Capability unavailable，不使 Shell 崩溃。"]
    },
    {
      "id": "REG-003",
      "area": "registry",
      "title": "Rules 仅由具体 Step 按需加载",
      "priority": "P0",
      "level": "integration",
      "automation": "automated",
      "required_by": "implementation",
      "fixture_ids": ["fixture_contract_assets"],
      "contract_refs": ["docs/capability-registry-contract.md#26.4", "docs/capability-context-pack-contract.md#42.8"],
      "assertions": ["Main Agent System Prompt 不常驻 Domain Rules，执行 Step 只能加载 Manifest 声明的 rule_refs。"]
    },
    {
      "id": "REG-004",
      "area": "registry",
      "title": "Public Manifest 不包含可执行前端内容",
      "priority": "P0",
      "level": "contract",
      "automation": "automated",